{
  "$defs": {
    "InventoryLineResponse": {
      "additionalProperties": false,
      "properties": {
        "available_qty": {
          "title": "Available Qty",
          "type": "string"
        },
        "product": {
          "$ref": "#/$defs/ProductResponse"
        }
      },
      "required": [
        "product",
        "available_qty"
      ],
      "title": "InventoryLineResponse",
      "type": "object"
    },
    "Pagination": {
      "additionalProperties": false,
      "properties": {
        "limit": {
          "maximum": 100,
          "minimum": 1,
          "title": "Limit",
          "type": "integer"
        },
        "offset": {
          "minimum": 0,
          "title": "Offset",
          "type": "integer"
        },
        "total": {
          "minimum": 0,
          "title": "Total",
          "type": "integer"
        }
      },
      "required": [
        "limit",
        "offset",
        "total"
      ],
      "title": "Pagination",
      "type": "object"
    },
    "ProductResponse": {
      "additionalProperties": false,
      "properties": {
        "active": {
          "title": "Active",
          "type": "boolean"
        },
        "attributes": {
          "additionalProperties": true,
          "title": "Attributes",
          "type": "object"
        },
        "benchmark_price": {
          "title": "Benchmark Price",
          "type": "string"
        },
        "category": {
          "title": "Category",
          "type": "string"
        },
        "id": {
          "format": "uuid",
          "title": "Id",
          "type": "string"
        },
        "name": {
          "title": "Name",
          "type": "string"
        },
        "sku": {
          "title": "Sku",
          "type": "string"
        },
        "unit": {
          "title": "Unit",
          "type": "string"
        }
      },
      "required": [
        "id",
        "sku",
        "name",
        "category",
        "unit",
        "benchmark_price",
        "attributes",
        "active"
      ],
      "title": "ProductResponse",
      "type": "object"
    }
  },
  "$id": "https://vanik.invalid/schemas/v1/InventoryResponse.schema.json",
  "$schema": "https://json-schema.org/draft/2020-12/schema",
  "additionalProperties": false,
  "properties": {
    "agent_id": {
      "format": "uuid",
      "title": "Agent Id",
      "type": "string"
    },
    "items": {
      "items": {
        "$ref": "#/$defs/InventoryLineResponse"
      },
      "title": "Items",
      "type": "array"
    },
    "pagination": {
      "$ref": "#/$defs/Pagination"
    },
    "principal_id": {
      "format": "uuid",
      "title": "Principal Id",
      "type": "string"
    }
  },
  "required": [
    "principal_id",
    "agent_id",
    "items",
    "pagination"
  ],
  "title": "InventoryResponse",
  "type": "object"
}
